{
  "$schema": "http://json-schema.org/draft-04/schema#",
  "type": "object",
  "properties": {
    "ruleId": {"$ref": "#/definitions/uuid"},
    "judiciaryId": {"$ref": "#/definitions/uuid"},
    "courtHouseId": {"$ref": "#/definitions/uuid"},
    "startDate": {"type": "string", "format": "date"},
    "endDate": {"type": "string", "format": "date"},
    "recurringType": {
      "type": "string",
      "enum": ["WEEKLY", "MONTHLY"]
    },
    "sessionType": {
      "type": "string",
      "enum": ["AM", "PM", "AD"]
    },
    "repeatDays": {
      "type": "array",
      "items": {
        "oneOf": [
          {
            "type": "string",
            "enum": ["MONDAY", "TUESDAY", "WEDNESDAY", "THURSDAY", "FRIDAY"]
          },
          {
            "type": "object",
            "properties": {
              "day": {
                "type": "string",
                "enum": ["MONDAY", "TUESDAY", "WEDNESDAY", "THURSDAY", "FRIDAY"]
              },
              "index": {"type": "integer"}
            },
            "required": ["day"]
          }
        ]
      }
    },
    "unavailabilities": {
      "type": "array",
      "items": {
        "type": "object",
        "properties": {
          "startDate": {"type": "string", "format": "date"},
          "endDate": {"type": "string", "format": "date"},
          "reason": {
            "type": "string",
            "enum": ["TRAINING", "ANNUAL_LEAVE", "OFFICIAL_BUSINESS", "SICK_LEAVE"]
          }
        },
        "required": ["startDate", "endDate"]
      }
    }
  },
  "required": ["ruleId", "judiciaryId", "courtHouseId", "startDate", "endDate", "repeatDays"],
  "definitions": {
    "uuid": {
      "type": "string",
      "pattern": "^[a-fA-F0-9]{8}-[a-fA-F0-9]{4}-[a-fA-F0-9]{4}-[a-fA-F0-9]{4}-[a-fA-F0-9]{12}$"
    }
  }
}
